{
  "type": "MeasurementRecord",
  "id": "meas-006",
  "ledger_version": 1,
  "references": [
    "prob-001",
    "prem-006"
  ],
  "premise_id": "prem-006",
  "method": "Searched working directory (grep -ril \"retry\" and ls -la) for a retry policy or a retry-attempt record on a job id, limited to problem.md and the runs/ records tree.",
  "result": "problem.md contains only the problem statement text (which itself lists suppressed-retry as one of three unproven explanations, not evidence of one). runs/.../records/ contains prem-003, prem-005, prem-006, cand-001, prob-001 as premise/candidate records, not fixture data; no retry policy document and no job-id-level retry attempt log exist in this directory.",
  "artefact": "test/results/2026-09-28-controller-x4-role-probe-3/problem.md; runs/20260928T083641-1415bed4/records/",
  "outcome": "inconclusive",
  "cost_usd": 0.0
}
